{
  "version": 1,
  "policy": {
    "model": "editorial-time-is-not-build-time",
    "freezeMode": "observed-projections-with-review-status",
    "approvedRecordsRequireProjectionConvergence": true,
    "technicalCommitsMayChangeEditorialDates": false
  },
  "sourceCommit": "c27176bf6cc61dcc4ca3411f38c307ab38002161",
  "records": {
    "/articles/20-antisovetov-pastoru/": {
      "route": "/articles/20-antisovetov-pastoru/",
      "canonical": "https://gospod-bog.ru/articles/20-antisovetov-pastoru/",
      "title": "20 антисоветов, как пастору разрушить своё служение | Господь Бог — Сила Моя",
      "metadataSource": "src/components/article-pilots/antisovetov/AntisovetovPageHead.astro",
      "contentType": "article",
      "editorialPublishedAt": "2026-05-13T00:00:00+03:00",
      "editorialModifiedAt": "2026-06-12T15:14:46+03:00",
      "originalWorkPublishedAt": null,
      "reviewStatus": "inconsistent-needs-review",
      "provenance": "production-like-dist-migration-freeze",
      "observations": {
        "visiblePublishedAt": "2026-05-13T00:00:00.000Z",
        "visibleModifiedAt": null,
        "metaPublishedAt": "2026-05-12T21:00:00.000Z",
        "metaModifiedAt": "2026-07-08T23:34:58.000Z",
        "jsonLdPublishedAt": "2026-05-12T21:00:00.000Z",
        "jsonLdModifiedAt": "2026-07-08T23:34:58.000Z",
        "searchPublishedAt": "2026-05-12T21:00:00.000Z",
        "searchModifiedAt": "2026-05-21T20:09:05.000Z",
        "sitemapLastmod": "2026-07-08T23:34:58.000Z",
        "rssPublishedAt": "2026-07-11T21:00:00.000Z"
      }
    },
    "/articles/chto-bibliya-nazyvaet-serdcem/": {
      "route": "/articles/chto-bibliya-nazyvaet-serdcem/",
      "canonical": "https://gospod-bog.ru/articles/chto-bibliya-nazyvaet-serdcem/",
      "title": "Библейская кардиология: что Библия называет сердцем | Господь Бог — Сила Моя",
      "metadataSource": "src/components/article-pilots/chto-bibliya-nazyvaet-serdcem/ChtoBibliyaPageHead.astro",
      "contentType": "article",
      "editorialPublishedAt": "2026-07-11T00:00:00+03:00",
      "editorialModifiedAt": "2026-07-11T00:00:00+03:00",
      "originalWorkPublishedAt": null,
      "reviewStatus": "inconsistent-needs-review",
      "provenance": "production-like-dist-migration-freeze",
      "observations": {
        "visiblePublishedAt": null,
        "visibleModifiedAt": null,
        "metaPublishedAt": "2026-07-10T21:00:00.000Z",
        "metaModifiedAt": "2026-07-10T21:00:00.000Z",
        "jsonLdPublishedAt": "2026-07-10T21:00:00.000Z",
        "jsonLdModifiedAt": "2026-07-10T21:00:00.000Z",
        "searchPublishedAt": "2026-07-10T21:00:00.000Z",
        "searchModifiedAt": "2026-07-10T21:00:00.000Z",
        "sitemapLastmod": "2026-07-14T18:00:00.000Z",
        "rssPublishedAt": "2026-07-11T21:00:00.000Z"
      }
    },
    "/articles/dzhon-gill-chast-1-chelovek/": {
      "route": "/articles/dzhon-gill-chast-1-chelovek/",
      "canonical": "https://gospod-bog.ru/articles/dzhon-gill-chast-1-chelovek/",
      "title": "Джон Гилл (1697–1771). Часть I: Человек — детство, призвание, семья",
      "metadataSource": "src/components/article-pilots/gill-part1/GillPart1PageHead.astro",
      "contentType": "article",
      "editorialPublishedAt": "2026-05-31T01:05:00+03:00",
      "editorialModifiedAt": "2026-06-12T15:14:46+03:00",
      "originalWorkPublishedAt": null,
      "reviewStatus": "inconsistent-needs-review",
      "provenance": "production-like-dist-migration-freeze",
      "observations": {
        "visiblePublishedAt": null,
        "visibleModifiedAt": null,
        "metaPublishedAt": "2026-05-30T22:05:00.000Z",
        "metaModifiedAt": "2026-07-08T23:34:58.000Z",
        "jsonLdPublishedAt": "2026-05-30T22:05:00.000Z",
        "jsonLdModifiedAt": "2026-07-08T23:34:58.000Z",
        "searchPublishedAt": "2026-05-25T21:00:00.000Z",
        "searchModifiedAt": "2026-06-09T21:00:00.000Z",
        "sitemapLastmod": "2026-07-08T23:34:58.000Z",
        "rssPublishedAt": "2026-07-11T21:00:00.000Z"
      }
    },
    "/articles/dzhon-gill-chast-2-uchenyi/": {
      "route": "/articles/dzhon-gill-chast-2-uchenyi/",
      "canonical": "https://gospod-bog.ru/articles/dzhon-gill-chast-2-uchenyi/",
      "title": "Джон Гилл (1697–1771). Часть II: Учёный — экзегеза, система, иврит",
      "metadataSource": "src/components/article-pilots/gill-part2/GillPart2PageHead.astro",
      "contentType": "article",
      "editorialPublishedAt": "2026-05-31T01:05:00+03:00",
      "editorialModifiedAt": "2026-06-12T15:14:46+03:00",
      "originalWorkPublishedAt": null,
      "reviewStatus": "inconsistent-needs-review",
      "provenance": "production-like-dist-migration-freeze",
      "observations": {
        "visiblePublishedAt": null,
        "visibleModifiedAt": null,
        "metaPublishedAt": "2026-05-30T22:05:00.000Z",
        "metaModifiedAt": "2026-07-08T23:34:58.000Z",
        "jsonLdPublishedAt": "2026-05-30T22:05:00.000Z",
        "jsonLdModifiedAt": "2026-07-08T23:34:58.000Z",
        "searchPublishedAt": "2026-05-25T21:00:00.000Z",
        "searchModifiedAt": "2026-06-09T21:00:00.000Z",
        "sitemapLastmod": "2026-07-08T23:34:58.000Z",
        "rssPublishedAt": "2026-07-11T21:00:00.000Z"
      }
    },
    "/articles/dzhon-gill-chast-3-nasledie/": {
      "route": "/articles/dzhon-gill-chast-3-nasledie/",
      "canonical": "https://gospod-bog.ru/articles/dzhon-gill-chast-3-nasledie/",
      "title": "Джон Гилл (1697–1771). Часть IV: Наследие — полемика, память, наука",
      "metadataSource": "src/components/article-pilots/gill-part3/GillPart3PageHead.astro",
      "contentType": "article",
      "editorialPublishedAt": "2026-05-31T01:05:00+03:00",
      "editorialModifiedAt": "2026-06-12T15:14:46+03:00",
      "originalWorkPublishedAt": null,
      "reviewStatus": "inconsistent-needs-review",
      "provenance": "production-like-dist-migration-freeze",
      "observations": {
        "visiblePublishedAt": null,
        "visibleModifiedAt": null,
        "metaPublishedAt": "2026-05-30T22:05:00.000Z",
        "metaModifiedAt": "2026-07-08T23:34:58.000Z",
        "jsonLdPublishedAt": "2026-05-30T22:05:00.000Z",
        "jsonLdModifiedAt": "2026-07-08T23:34:58.000Z",
        "searchPublishedAt": "2026-05-25T21:00:00.000Z",
        "searchModifiedAt": "2026-06-09T21:00:00.000Z",
        "sitemapLastmod": "2026-07-08T23:34:58.000Z",
        "rssPublishedAt": "2026-07-11T21:00:00.000Z"
      }
    },
    "/articles/dzhon-gill-chast-4-ekzeget/": {
      "route": "/articles/dzhon-gill-chast-4-ekzeget/",
      "canonical": "https://gospod-bog.ru/articles/dzhon-gill-chast-4-ekzeget/",
      "title": "Джон Гилл (1697–1771). Часть III: Экзегет — экзегеза, полемика, отвержение",
      "metadataSource": "src/components/article-pilots/gill-part4/GillPart4PageHead.astro",
      "contentType": "article",
      "editorialPublishedAt": "2026-07-09T12:00:00+03:00",
      "editorialModifiedAt": "2026-07-09T12:00:00+03:00",
      "originalWorkPublishedAt": null,
      "reviewStatus": "inconsistent-needs-review",
      "provenance": "production-like-dist-migration-freeze",
      "observations": {
        "visiblePublishedAt": null,
        "visibleModifiedAt": null,
        "metaPublishedAt": "2026-07-09T09:00:00.000Z",
        "metaModifiedAt": "2026-07-09T09:00:00.000Z",
        "jsonLdPublishedAt": "2026-07-09T09:00:00.000Z",
        "jsonLdModifiedAt": "2026-07-09T09:00:00.000Z",
        "searchPublishedAt": "2026-07-08T21:00:00.000Z",
        "searchModifiedAt": "2026-07-08T21:00:00.000Z",
        "sitemapLastmod": "2026-07-09T09:00:00.000Z",
        "rssPublishedAt": "2026-07-11T21:00:00.000Z"
      }
    },
    "/articles/dzhon-gill-istoricheskiy-kontekst/": {
      "route": "/articles/dzhon-gill-istoricheskiy-kontekst/",
      "canonical": "https://gospod-bog.ru/articles/dzhon-gill-istoricheskiy-kontekst/",
      "title": "Джон Гилл: исторический контекст — мир пуритан и баптистов XVIII века",
      "metadataSource": "src/components/article-pilots/gill-context/GillContextPageHead.astro",
      "contentType": "article",
      "editorialPublishedAt": "2026-06-01T20:17:32+03:00",
      "editorialModifiedAt": "2026-06-12T15:14:46+03:00",
      "originalWorkPublishedAt": null,
      "reviewStatus": "inconsistent-needs-review",
      "provenance": "production-like-dist-migration-freeze",
      "observations": {
        "visiblePublishedAt": "2026-06-01T00:00:00.000Z",
        "visibleModifiedAt": null,
        "metaPublishedAt": "2026-06-01T17:17:32.000Z",
        "metaModifiedAt": "2026-07-08T23:34:58.000Z",
        "jsonLdPublishedAt": "2026-06-01T17:17:32.000Z",
        "jsonLdModifiedAt": "2026-07-08T23:34:58.000Z",
        "searchPublishedAt": "2026-05-31T21:00:00.000Z",
        "searchModifiedAt": "2026-06-09T21:00:00.000Z",
        "sitemapLastmod": "2026-07-08T23:34:58.000Z",
        "rssPublishedAt": "2026-07-11T21:00:00.000Z"
      }
    },
    "/articles/dzhon-gill-spravochnik/": {
      "route": "/articles/dzhon-gill-spravochnik/",
      "canonical": "https://gospod-bog.ru/articles/dzhon-gill-spravochnik/",
      "title": "Джон Гилл: справочник — хронология, труды, источники",
      "metadataSource": "src/components/article-pilots/gill-spravochnik/GillSpravochnikPageHead.astro",
      "contentType": "article",
      "editorialPublishedAt": "2026-06-01T20:17:32+03:00",
      "editorialModifiedAt": "2026-06-12T15:14:46+03:00",
      "originalWorkPublishedAt": null,
      "reviewStatus": "inconsistent-needs-review",
      "provenance": "production-like-dist-migration-freeze",
      "observations": {
        "visiblePublishedAt": "2026-06-01T00:00:00.000Z",
        "visibleModifiedAt": null,
        "metaPublishedAt": "2026-06-01T17:17:32.000Z",
        "metaModifiedAt": "2026-07-08T23:34:58.000Z",
        "jsonLdPublishedAt": "2026-06-01T17:17:32.000Z",
        "jsonLdModifiedAt": "2026-07-08T23:34:58.000Z",
        "searchPublishedAt": "2026-05-31T21:00:00.000Z",